{"active_behavior_authorization":false,"axis_id":"queued_send_burst_budget","content_sha256":"56d19587c75b9e5c551509186b2eb21e3df363d37fdf09409cd728ff3d4d797b","document_id":"promotion_input.queued_send_burst_budget.single_datagram","document_version":1,"independent_outcome":null,"mechanism_capture_ref":{"document_id":"mechanism_capture.queued-single","schema_version":"adaptive-runtime-actuation-mechanism-capture-v3","document_version":3,"content_sha256":"d267ff72f66d378c75d35c1f509fb0afa7caeea2d9975afc1f44f3ebcb6ee266"},"operation_evidence_ref":{"document_id":"operation_evidence.run.runtime_proof_capture.queued-single","schema_version":"adaptive-runtime-operation-evidence-v4","document_version":4,"content_sha256":"aafa8b02ba2ec3d2350c2a385cac4aca0a1db3047ddba6ca91de0806916d26de"},"performance_acceptance_authorization":false,"policy_value":"single_datagram","projection_ref":{"document_id":"projection.v3.experiment_run.run.runtime_proof_capture.queued-single","schema_version":"adaptive-runtime-experiment-evidence-projection-v3","document_version":3,"content_sha256":"62b2e06e7c0ece9f04d0f6486dbd174459f1baa7dbda0026f94a1e694e2358f6"},"promotion_state":"not_applied","proof_ref":{"document_id":"proof_candidate.queued_send_burst_budget.single_datagram.runtime-proof-capture-20260727","schema_version":"adaptive-runtime-actuation-proof-evidence-v3","document_version":3,"content_sha256":"762bffab650bb68c2dd0277fff9e23b4b1cd4ea279ad7cb68762c64e3343ed35"},"review_artifact_ref":null,"reviewed_proof_catalog_base_hash":"95feeea663c264365d79f370b1b1790f8e44002deb38c4cbaa8660c5531eb1eb","reviewer_identity":null,"schema_version":"adaptive-runtime-actuation-proof-promotion-input-v1","trace_references":{"architecture_ids":["ARC-QUIC-CRT-0113"],"requirement_ids":["REQ-QUIC-CRT-0235","REQ-QUIC-CRT-0236","REQ-QUIC-CRT-0237","REQ-QUIC-CRT-0238","REQ-QUIC-CRT-0239","REQ-QUIC-CRT-0240"],"verification_ids":["VER-QUIC-CRT-0115"],"work_item_ids":["WI-QUIC-CRT-0114"]}}